{"admit":{"checker_sha256":["cb07a41e1dbd374a9ce87fb7860c564ac8e49659974253a61f9d96d3f338ef0f"],"solvers":null},"author":"polyhedraproof specification vectors","created_utc":"2026-10-01T00:00:00.000Z","format":"cubeproof-campaign-1","formulas":[{"bundle":"bundles/sat","formula_sha256":"6642f3ff4fae6f869a53f303bc768802cec0a16af731686c6bf03f342cf0489e","key":"sat"}],"policy":{"anomaly_limit":3,"checker_max_heap_mib":8192,"checker_max_stack_mib":2048,"checker_slack_mib":256,"checker_stack_mib":256,"checker_time_base_ms":600000,"checker_time_per_100mb_ms":60000,"heap_fit":{"coefficient_milli":3230,"exponent_milli":711,"margin_milli":1500,"min_mib":512},"leaf_time_ms":{"12":900000,"default":300000},"machine_failure_limit":5,"max_cube_size":60,"proof_cap_bytes":4294967296,"proof_mode":"transient","quarantine_quota_bytes":21474836480,"solver_memory_bytes":1073741824,"split":{"method":"lookahead-v1","pool":null,"probe_limit":100000,"vars":4,"wall_ms":1000},"stop_grace_ms":30000,"stream_heap_mib":1024,"term_grace_ms":10000,"tool_retries":3},"root_splits":[],"roots":[{"cube":[-1],"formula_sha256":"6642f3ff4fae6f869a53f303bc768802cec0a16af731686c6bf03f342cf0489e"}],"tools":{"checker":{"name":"cake_lpr","sha256":"cb07a41e1dbd374a9ce87fb7860c564ac8e49659974253a61f9d96d3f338ef0f"},"solver":{"argv":["--lrat"],"name":"cadical","sha256":"ed4d6e88b3adcaab6f51494a5c45b3a0d9d653dced766d1ad3d39fe00d907416"}}}
